{
  "schemaVersion": "gridworks.commercial-ux.gold-state-manifest.v1",
  "protocol": "GRIDWORKS-COMMERCIAL-UX-v1.1",
  "candidateIndependent": true,
  "scoreBearingCapture": false,
  "bindingComplete": false,
  "scoreBearingCaptureAllowed": false,
  "candidateExecutionPolicy": {
    "candidateAuthorityHashOwner": "candidate manifest",
    "candidateGoldBindingHashOwner": "binding manifest referenced by evaluation-run manifest",
    "goldContractRole": "immutable recipe structure, semantic source references and typed checkpoint predicates",
    "requiredCandidateAuthorityHashes": [
      "world",
      "campaign",
      "coreReplay",
      "coreContracts",
      "deterministicWitness",
      "nativeSmokeWitness",
      "storyHarness",
      "storyManifestOutput",
      "goldReplayBuildInputs"
    ],
    "requiredCandidateBindingHashes": "accepted journal and canonical snapshot for every applicable prefix and checkpoint",
    "candidateManifestValidation": "required before --require-score-ready can pass"
  },
  "candidateBindingOverlay": {
    "schema": "gold-binding-manifest.schema.json",
    "selfHashField": "goldBindingManifestSha256",
    "rawHashOwner": "evaluation-run manifest artifacts.goldBindingManifestRawSha256",
    "prefixCount": 12,
    "checkpointCount": 49,
    "applicableBindingCount": 56,
    "notApplicableBindingCount": 5,
    "e09WitnessRequired": true,
    "rawBundleRequired": true,
    "rawBundleEntryCount": 112,
    "rawBundleValidation": "OPEN_EXACT_BYTES_RECOMPUTE_RAW_HASH_LENGTH_REJECT_EXTRA_SYMLINK_THEN_CORE_DESERIALIZE_RESTORE_AND_EXACT_CANONICAL_SNAPSHOT_COMPARE",
    "immutableTemplateBindingsRemainPending": true,
    "scoreReadyCommandRequires": ["--binding-manifest", "--candidate-manifest", "--require-score-ready"]
  },
  "nextRequiredGenerator": {
    "status": "MISSING_IN_CURRENT_SCOPE",
    "path": "tools/commercial-ux/native/capture-gold-state.py",
    "commandTemplate": "python3 tools/commercial-ux/native/capture-gold-state.py --recipe tools/commercial-ux/native/coverage-recipe.json --holdout-recipe-id {RECIPE_ID} --native-executable {ABSOLUTE_NATIVE_EXECUTABLE} --output {ABSOLUTE_OUTPUT_DIRECTORY}",
    "requiredOutputs": [
      "candidate manifest with exact candidate source/output hashes",
      "candidate-specific gold-binding manifest conforming to gold-binding-manifest.schema.json",
      "CommercialCampaignSaveCodec accepted-journal bytes, command count and SHA-256 at every applicable prefix and checkpoint",
      "exact canonical CommercialCoreSnapshot bytes independently regenerated by Core replay at every applicable prefix and checkpoint; presentation-state evidence remains owned by native coverage",
      "process-separated pre-exit and post-resume equality records for E09 and E10"
    ],
    "blockingPrerequisite": "Implement a NORTH_BANK_PROMISE/NORTH_BANK_BUILD LineDrafting two-process witness for E09; the current native smoke resumes a different WHOSE_MARGIN draft."
  },
  "authorities": {
    "world": {
      "path": "data/release-world-v2.json",
      "schemaVersion": "gridworks.commercial.world.v2",
      "authorityId": "CHEONGRYU_COMMERCIAL_V2",
      "candidateExecutionSha256": null
    },
    "campaign": {
      "path": "data/release-campaign-v2.json",
      "schemaVersion": "gridworks.commercial.campaign.v2",
      "authorityId": "CHEONGRYU_COMMERCIAL_CAMPAIGN_V2",
      "candidateExecutionSha256": null
    },
    "coverageRecipe": {
      "path": "tools/commercial-ux/native/coverage-recipe.json",
      "sha256": "sha256:dfb2e7950defe8d50073f26529b0ae2d0b2418f92884a412a802afd64d271c7d"
    },
    "conceptExposure": {
      "path": "tools/commercial-ux/native/concept-exposure-manifest.json",
      "sha256": "sha256:1a5bffddcf78c8952f1d5a47ee5f5926c0bc5c5c6e0fbf2cbc0291c24783e9f5"
    },
    "coreReplay": {
      "path": "src/Gridworks.Core/Release/V2/CommercialCoreRun.cs",
      "referenceMode": "PATH_AND_MEMBER_SEMANTIC",
      "members": ["CommercialCoreRun", "GetSnapshot", "Replay"],
      "candidateExecutionSha256": null
    },
    "coreContracts": {
      "path": "src/Gridworks.Core/Release/V2/CommercialCoreRunContracts.cs",
      "referenceMode": "PATH_AND_MEMBER_SEMANTIC",
      "members": ["CommercialCoreSnapshot", "CommercialChapterResultRecord"],
      "candidateExecutionSha256": null
    },
    "deterministicWitness": {
      "path": "tools/Gridworks.CommercialChecks/Program.cs",
      "referenceMode": "PATH_AND_MEMBER_SEMANTIC",
      "members": ["CompleteCampaignFirstThree", "CompleteCampaignFirstFour", "CheckCommercialCampaignFinalEightEpilogue"],
      "candidateExecutionSha256": null
    },
    "nativeSmokeWitness": {
      "path": "game/CommercialMain.Smoke.cs",
      "referenceMode": "PATH_AND_MEMBER_SEMANTIC",
      "members": ["RunPresentationSmoke", "RunCampaignSmoke", "RunCampaignCompletionSmoke", "RunCampaignCompletedResumeSmoke"],
      "candidateExecutionSha256": null
    },
    "storyHarness": {
      "path": "tools/Gridworks.CommercialChecks/CommercialStoryPartHarness.cs",
      "referenceMode": "PATH_AND_MEMBER_SEMANTIC",
      "members": ["CommercialStoryPartHarness", "SerializeManifest"],
      "candidateExecutionSha256": null
    },
    "goldReplayVerifier": {
      "path": "tools/Gridworks.CommercialChecks/CommercialGoldReplayVerifier.cs",
      "sha256": "sha256:0e40668e66d2a9b45999dd443c2344bccdd8171ccaa2c683d1207be20a521d77",
      "entrypointPath": "tools/Gridworks.GoldReplayVerifier/Program.cs",
      "entrypointSha256": "sha256:56a3ce93484aa69fe90ddafeb01a09e2cae500bcb46333c53397c8708f0c1b79",
      "projectPath": "tools/Gridworks.GoldReplayVerifier/Gridworks.GoldReplayVerifier.csproj",
      "projectSha256": "sha256:669ccf19d61c25fdec1898b6c49558d9b0ca3c7222bea84486220d70decaa200",
      "buildInputsPath": "tools/commercial-ux/native/gold-replay-build-inputs.json",
      "buildInputsSha256": "sha256:61cefe4f8e9021b9a47d2855724866919432ae4722668a86d8f74375988789c9",
      "referenceMode": "EXACT_RAW_SHA_AND_CORE_REPLAY",
      "members": ["CommercialGoldReplayVerifier", "VerifyBatch", "EmitSnapshot"]
    },
    "storyManifest": {
      "generator": "dotnet run --project tools/Gridworks.CommercialChecks/Gridworks.CommercialChecks.csproj -c Release -- --story-manifest",
      "schemaVersion": "gridworks.commercial.story-manifest.v1",
      "partCount": 26,
      "resultPartCount": 12,
      "candidateExecutionRawOutputSha256": null
    }
  },
  "hashPolicy": {
    "algorithm": "SHA-256",
    "journalCanonicalization": "CommercialCampaignSaveCodec.Serialize exact bytes from accepted command journal prefix",
    "snapshotCanonicalization": "Exact UTF-8 System.Text.Json camelCase/no-null/non-indented CommercialCoreSnapshot bytes regenerated after CommercialCampaignSaveCodec deserialize+restore",
    "captureCanonicalization": "Not owned by this manifest; no frame, video or audio hash is fabricated here",
    "pendingStatus": "PENDING_NATIVE_REPLAY",
    "unboundStatus": "UNBOUND_REQUIRED_WITNESS",
    "notApplicableStatus": "NOT_APPLICABLE"
  },
  "prefixes": [
    {
      "prefixId": "PREFIX-FRESH-TITLE",
      "replayAuthority": [
        {"path": "game/CommercialMain.Smoke.cs", "member": "RunPresentationSmoke", "role": "fresh title and settings actual-input witness"}
      ],
      "expectedStart": {"snapshotRequired": false, "presentationMode": "Title"},
      "journalBinding": {"status": "NOT_APPLICABLE", "sha256": null, "commandCount": null},
      "snapshotBinding": {"status": "NOT_APPLICABLE", "sha256": null}
    },
    {
      "prefixId": "PREFIX-FIRST-LIGHT-START",
      "replayAuthority": [
        {"path": "src/Gridworks.Core/Release/V2/CommercialCoreRun.cs", "member": "CommercialCoreRun(CommercialWorldDefinition world, CommercialCampaignDefinition campaign)", "role": "empty accepted journal"},
        {"path": "tools/Gridworks.CommercialChecks/Program.cs", "member": "CompleteCampaignFirstThree", "role": "chapter-start prefix index 0 authority"}
      ],
      "expectedStart": {"snapshotRequired": true, "chapterId": "FIRST_LIGHT", "decisionWindowId": "FIRST_LIGHT_BUILD", "decisionWindowIndex": 0, "chapterResultsCount": 0, "campaignComplete": false, "constructionPhase": "Ready"},
      "journalBinding": {"status": "PENDING_NATIVE_REPLAY", "sha256": null, "commandCount": null},
      "snapshotBinding": {"status": "PENDING_NATIVE_REPLAY", "sha256": null}
    },
    {
      "prefixId": "PREFIX-SECOND-HEART-START",
      "replayAuthority": [
        {"path": "tools/Gridworks.CommercialChecks/Program.cs", "member": "CompleteCampaignFirstThree", "role": "take ChapterStartCommandCounts[1] accepted prefix"},
        {"path": "game/CommercialMain.Smoke.cs", "member": "RunCampaignSmoke", "role": "actual-input transition witness"}
      ],
      "expectedStart": {"snapshotRequired": true, "chapterId": "SECOND_HEART", "decisionWindowId": "SECOND_HEART_BUILD", "decisionWindowIndex": 0, "chapterResultsCount": 1, "campaignComplete": false, "constructionPhase": "Ready"},
      "journalBinding": {"status": "PENDING_NATIVE_REPLAY", "sha256": null, "commandCount": null},
      "snapshotBinding": {"status": "PENDING_NATIVE_REPLAY", "sha256": null}
    },
    {
      "prefixId": "PREFIX-SECOND-SOURCE-START",
      "replayAuthority": [
        {"path": "tools/Gridworks.CommercialChecks/Program.cs", "member": "CompleteCampaignFirstThree", "role": "take ChapterStartCommandCounts[2] accepted prefix"},
        {"path": "game/CommercialMain.Smoke.cs", "member": "RunCampaignSmoke", "role": "actual-input transition witness"}
      ],
      "expectedStart": {"snapshotRequired": true, "chapterId": "SECOND_SOURCE", "decisionWindowId": "SECOND_SOURCE_BUILD", "decisionWindowIndex": 0, "chapterResultsCount": 2, "campaignComplete": false, "constructionPhase": "Ready"},
      "journalBinding": {"status": "PENDING_NATIVE_REPLAY", "sha256": null, "commandCount": null},
      "snapshotBinding": {"status": "PENDING_NATIVE_REPLAY", "sha256": null}